"DESCRIPTION","DURATION IN MS","NAME","PARENT SUITE","START TIME","STATUS","STOP TIME","SUB SUITE","SUITE","TEST CLASS","TEST METHOD"
"","24766","Não deve quebrar ao digitar uma sequência muito longa","","Wed Aug 27 20:12:37 GMT-03:00 2025","passed","Wed Aug 27 20:13:01 GMT-03:00 2025","","Central de Atendimento ao Cliente TAT","",""
"","1971","verifica o título da aplicação","","Wed Aug 27 20:11:50 GMT-03:00 2025","passed","Wed Aug 27 20:11:52 GMT-03:00 2025","","Central de Atendimento ao Cliente TAT","",""
"","13442","Não deve exibir sugestões para caracteres inválidos","","Wed Aug 27 20:12:23 GMT-03:00 2025","passed","Wed Aug 27 20:12:36 GMT-03:00 2025","","Central de Atendimento ao Cliente TAT","",""
"","13727","Não deve exibir sugestões quando o campo de busca estiver vazio","","Wed Aug 27 20:12:08 GMT-03:00 2025","passed","Wed Aug 27 20:12:22 GMT-03:00 2025","","Central de Atendimento ao Cliente TAT","",""
"","14889","Deve exibir sugestões relacionadas quando o usuário digitar ""notebook""","","Wed Aug 27 20:11:53 GMT-03:00 2025","passed","Wed Aug 27 20:12:08 GMT-03:00 2025","","Central de Atendimento ao Cliente TAT","",""
"","215","testa a página da política de privacidade de forma independente","","Wed Aug 27 20:11:38 GMT-03:00 2025","passed","Wed Aug 27 20:11:38 GMT-03:00 2025","","","",""
"","855","encontra o gato","","Wed Aug 27 20:11:30 GMT-03:00 2025","passed","Wed Aug 27 20:11:31 GMT-03:00 2025","","Central de Atendimento ao Cliente TAT","",""
"","20537","Não deve exibir sugestões se o usuário apenas clicar no campo de busca","","Wed Aug 27 20:13:10 GMT-03:00 2025","passed","Wed Aug 27 20:13:30 GMT-03:00 2025","","Central de Atendimento ao Cliente TAT","",""
